{
  "source_id": "pdf-life-in-3-easy-lessons",
  "source_type": "pdf",
  "title": "Life in 3 Easy Lessons",
  "author": "Richard Moon",
  "public_url": "/books/Lifein3EasyLessons.pdf",
  "license_status": "public-pdf",
  "exact_source_text": "Life in 3 Easy Lessons — The power of Aikido in the business of living. Listed among Richard Moon's publicly offered study PDFs on quantumaikido.com/books/.\n\nLESSON is practiced through the exercise of aligning a Harmonious Relationship. Harmonious relationship is developed through the principles of adaptability and blending. It implies fluidity with the ceaseless change that is life. Harmonious relationship means non-resistance to the unfolding universe, accepting and receiving what is, rather than opposing it. “Harmonious” and “arm” both derive from a Greek root meaning “fitting” or “joining,” as an arm fits or joins into the shoulder. Musically a harmonious relationship is one that enriches the overtone series of two or more notes increasing the power of their effect. A choir sings different parts in a harmonious relationship. As we harmonize with differing aspects the overtones produced create possibilities that echo into infinity. Harmonious relationship experiences the power of a coherent, unified whole. An interconnected state of being participating in the universe is at the heart of Aikido. When we are non-resistant to experience our field of perception is expanded. The more we open ourselves, the more we perceive. We can see our actions in relationship to the whole. Non-resistance produces a field of energy which has the potential for self-organization, The forces in a self-organizing system naturally seek a relationship of harmony. Science calls this tendency entrainment. - Lit. to get on board. The natural harmony between centripetal and centrifugal forces keeps planets in their orbits. Harmony between the individual and the universal keeps our lives in balance. Everything in the universe exists in relationship. Nothing exists in isolation. Everything is connected to everything. We exist in relationship to the planet, to each other, to our thoughts, values and perceptions, creating a universe of complexity and possibility. Harmonizing with the universe takes us beyond the limits of our perception. Our state of being is the fundamental tone out of which we create our life and our world. Rigid thought will conflict with the flow of change. Freedom of thought opens the possibility of resolving conflict within a system. When we perceive with an open mind, we create the possibility to design a harmonious relationship. Once we are paying attention we can align a tone that harmonizes with what is unfolding. Aikido aligns awareness, perception and action into relationship of harmony. Our refinement of that harmony generates a reciprocating process in others. Moving in harmony, without resistance, reveals our inter-relatedness and reconciles our differences. Harmony with another begins with the first lesson. Feeling where you are means being present and grounded, aware of and in harmony with your own experience. Coming into an inner coherence, unified in body, mind, and spirit, affects the tone and quality of any relationship. Harmony within creates a reciprocating echo producing harmony in the external world as a natural outcome."
}
