{
  "source_id": "page-books-index",
  "source_type": "page",
  "title": "Books by Richard Moon",
  "author": "Richard Moon",
  "public_url": "/books.html",
  "license_status": "already-public-on-quantumaikido",
  "exact_source_text": "Quantum Aikido: The Power of Harmony by Richard Moon · Inner Traditions / Park Street Press, 2026 · 207 pages. The Power of Extraordinary Listening — A quantum leap in communication & commonwealth. The Business of Listening — Conversations with CEOs who have used the Listening work. Life in 3 Easy Lessons — The power of Aikido in the business of living."
}
