{
  "source_id": "page-book",
  "source_type": "page",
  "title": "Quantum Aikido: The Power of Harmony",
  "author": "Richard Moon",
  "public_url": "/book",
  "isbn": "9781644119785",
  "publisher": "Inner Traditions / Park Street Press",
  "date_published": "2026-01-06",
  "license_status": "already-public-on-quantumaikido",
  "exact_source_text": "What if conflict isn't something to win or lose, but energy waiting to be transformed? Quantum Aikido bridges ancient wisdom with modern physics, teaching readers to transform conflict into creative harmony. Conflict as energy to harmonize, not defeat. Recognizing pressure as information. Channeling reactivity into creativity. Cyprus peace negotiations. Corporate coaching. High-stakes conflict. The floating bridge of heaven where convention meets creativity."
}
