{
  "source_id": "blog-quantum-pause",
  "source_type": "blog",
  "title": "the quantum pause",
  "author": "Richard Moon",
  "public_url": "https://aikifield.com/blog/quantum-pause",
  "date_published": "2026-01-06",
  "license_status": "already-public-on-quantumaikido",
  "exact_source_text": "Between stimulus and response lies a space. In that space lives freedom. That space—between what happens and how you respond—that's where everything pivots. That gap is the Quantum Pause. In Aikido, we train this every day. Someone attacks. There's a moment—infinitely brief, infinitely spacious—before response. In that moment, everything is possible. Conflict or harmony. Violence or resolution. Reaction or creation. Without the pause, you collapse into the same pattern every time. With the pause, you choose which reality to create."
}
