{
  "source_id": "pdf-tpoel",
  "source_type": "pdf",
  "title": "The Power of Extraordinary Listening",
  "author": "Richard Moon",
  "public_url": "/books/tpoel.pdf",
  "license_status": "public-pdf",
  "exact_source_text": "The Power of Extraordinary Listening — A quantum leap in communication & commonwealth. Listed among Richard Moon's publicly offered study PDFs on quantumaikido.com/books/."
}
