{
  "source_id": "page-podcasts",
  "source_type": "page",
  "title": "Podcasts — Consciousness, Awareness, and the Art of Transformation",
  "author": "Richard Moon",
  "public_url": "/podcasts",
  "youtube_url": "https://www.youtube.com/watch?v=jf5bfv5gSew",
  "youtube_id": "jf5bfv5gSew",
  "date_published": "2026-04-15",
  "license_status": "already-public-on-quantumaikido",
  "segments": [
    {
      "label": "Redefining the Warrior",
      "start_seconds": 86
    },
    {
      "label": "Aikido as a consciousness study",
      "start_seconds": 160
    },
    {
      "label": "The force of disturbance is creativity itself",
      "start_seconds": 413
    }
  ],
  "exact_source_text": "Consciousness, Awareness, and the Art of Transformation. Life Hypnosis. Host: Ana Felice. \"The force of disturbance is creativity itself.\" Ana Felice and Richard Moon redefine what it means to be a warrior — resolving war to find peace — and explore Aikido as a consciousness study with tangible feedback. Watch on YouTube https://m.youtube.com/watch?v=jf5bfv5gSew"
}
