{
  "source_id": "page-how-it-works",
  "source_type": "page",
  "title": "Discussing The Unified Field product copy",
  "author": "The Creative Unified Field",
  "public_url": "https://quantumaikido.com/members",
  "license_status": "already-public-on-quantumaikido",
  "exact_source_text": "Discussing The Unified Field. AI-supported guidance for embodied practice, awareness, and constructive interaction. AI-generated responses informed by the Creative Unified Field field of teachings both written and oral. Request a handoff to a human coach when you need more.",
  "notes": "Product description from the members chat intro; not a teaching source."
}
