{
  "source_id": "pdf-business-of-listening",
  "source_type": "pdf",
  "title": "The Business of Listening",
  "author": "Richard Moon",
  "public_url": "/books/TheBusinessofListening.pdf",
  "license_status": "public-pdf",
  "exact_source_text": "The Business of Listening — Conversations with CEOs who have used the Listening work. Listed among Richard Moon's publicly offered study PDFs on quantumaikido.com/books/."
}
